[
  {
    "id": "EXAMPLE-QUALITY-DHU",
    "canonicalName": "Defects per Hundred Units",
    "role": "CANONICAL",
    "lifecycleStatus": "ACTIVE_EXAMPLE",
    "formulaVersion": "15.0",
    "businessDefinition": "Number of defect events found per 100 inspected units.",
    "businessFormula": "DefectEvents / InspectedUnits * 100",
    "calculationPrimitive": "NORMALIZED_EVENT_RATE",
    "numerator": "DefectEvents",
    "denominator": "InspectedUnits",
    "normalizerK": 100,
    "canonicalUom": "defects_per_100_inspected_units",
    "grain": "InspectionID x DefectEventID",
    "eligiblePopulation": "Valid inspection events and their governed inspected-unit exposure",
    "temporalClass": "PERIOD_EXPOSURE",
    "aggregationRule": "SUM(DefectEvents) / SUM(InspectedUnits) * 100",
    "zeroNullErrorPolicy": "0 defects with positive exposure is zero; zero exposure is N/A; defects with zero exposure is INVALID",
    "directionality": "lower_is_better",
    "goalFunction": "MINIMIZE",
    "owner": "Quality",
    "dataSteward": "Quality data steward",
    "releaseStatus": "MAPPING_PENDING",
    "physicalSource": {"mappingStatus": "PENDING", "fields": []}
  },
  {
    "id": "EXAMPLE-QUALITY-DEFECTIVE-UNIT-RATE",
    "canonicalName": "Defective Unit Rate",
    "role": "CANONICAL",
    "lifecycleStatus": "ACTIVE_EXAMPLE",
    "formulaVersion": "15.0",
    "businessDefinition": "Share of inspected units with at least one qualifying defect.",
    "businessFormula": "UniqueDefectiveUnits / InspectedUnits",
    "calculationPrimitive": "TRUE_SUBSET_SHARE",
    "numerator": "UniqueDefectiveUnits",
    "denominator": "InspectedUnits",
    "canonicalUom": "ratio",
    "grain": "InspectionID x UnitID",
    "eligiblePopulation": "Unique inspected units in governed inspections",
    "temporalClass": "PERIOD_EXPOSURE",
    "aggregationRule": "COUNT(DISTINCT DefectiveUnitID) / COUNT(DISTINCT InspectedUnitID) at the governed perimeter",
    "zeroNullErrorPolicy": "0 defective with positive exposure is zero; zero exposure is N/A; numerator greater than denominator is INVALID",
    "directionality": "lower_is_better",
    "goalFunction": "MINIMIZE",
    "owner": "Quality",
    "dataSteward": "Quality data steward",
    "releaseStatus": "MAPPING_PENDING",
    "physicalSource": {"mappingStatus": "PENDING", "fields": []}
  },
  {
    "id": "EXAMPLE-PRODUCTION-OEE",
    "canonicalName": "Overall Equipment Effectiveness",
    "role": "CANONICAL",
    "lifecycleStatus": "ACTIVE_EXAMPLE",
    "formulaVersion": "15.0",
    "businessDefinition": "Availability multiplied by performance multiplied by quality for the governed equipment production window.",
    "businessFormula": "Availability * Performance * Quality",
    "calculationPrimitive": "PRODUCT_OF_COMPONENTS",
    "canonicalUom": "ratio",
    "grain": "EquipmentID x ProductionWindowID",
    "eligiblePopulation": "Governed planned production windows for in-scope equipment",
    "temporalClass": "PERIOD_EXPOSURE",
    "aggregationRule": "Recompute components from base totals at target perimeter, then multiply",
    "zeroNullErrorPolicy": "Missing component is MISSING; invalid denominator in component is INVALID; do not coalesce to zero",
    "directionality": "contextual_higher",
    "goalFunction": "TARGET_BAND",
    "owner": "Production engineering",
    "dataSteward": "MES/production data steward",
    "releaseStatus": "MAPPING_PENDING",
    "physicalSource": {"mappingStatus": "PENDING", "fields": []}
  },
  {
    "id": "EXAMPLE-PLANNING-WAPE",
    "canonicalName": "Forecast WAPE",
    "role": "CANONICAL",
    "lifecycleStatus": "ACTIVE_EXAMPLE",
    "formulaVersion": "15.0",
    "businessDefinition": "Absolute forecast error as a share of total actual magnitude for one frozen forecast evaluation window.",
    "businessFormula": "SUM(ABS(Forecast-Actual)) / SUM(ABS(Actual))",
    "calculationPrimitive": "WAPE",
    "numerator": "AbsoluteForecastError",
    "denominator": "AbsoluteActual",
    "canonicalUom": "ratio",
    "grain": "ForecastVersionID x ItemLocationTimeBucket",
    "eligiblePopulation": "Actualized observations belonging to the governed frozen forecast horizon",
    "temporalClass": "FORECAST_EVALUATION_WINDOW",
    "aggregationRule": "SUM absolute errors / SUM absolute actuals",
    "zeroNullErrorPolicy": "Actual base below materiality floor is N/A according to definition; missing frozen forecast is MISSING",
    "directionality": "lower_is_better",
    "goalFunction": "MINIMIZE",
    "owner": "Planning",
    "dataSteward": "Planning data steward",
    "releaseStatus": "MAPPING_PENDING",
    "physicalSource": {"mappingStatus": "PENDING", "fields": []}
  },
  {
    "id": "EXAMPLE-MARKETING-CPM",
    "canonicalName": "Cost per Thousand Impressions",
    "role": "CANONICAL",
    "lifecycleStatus": "ACTIVE_EXAMPLE",
    "formulaVersion": "15.0",
    "businessDefinition": "Eligible media cost per 1,000 governed impressions.",
    "businessFormula": "MediaCost / Impressions * 1000",
    "calculationPrimitive": "NORMALIZED_EVENT_RATE",
    "numerator": "MediaCost",
    "denominator": "Impressions",
    "normalizerK": 1000,
    "canonicalUom": "currency_per_1000_impressions",
    "grain": "CampaignID x ChannelID x ReportingBucket",
    "eligiblePopulation": "Governed paid-media spend and matched impressions in the same campaign/channel window",
    "temporalClass": "PERIOD_EXPOSURE",
    "aggregationRule": "SUM(MediaCost) / SUM(Impressions) * 1000",
    "zeroNullErrorPolicy": "Zero impressions with positive cost is INVALID; zero cost with positive impressions is zero; zero/zero is N/A",
    "directionality": "diagnostic",
    "goalFunction": "DIAGNOSTIC",
    "owner": "Marketing",
    "dataSteward": "Marketing data steward",
    "releaseStatus": "MAPPING_PENDING",
    "physicalSource": {"mappingStatus": "PENDING", "fields": []}
  },
  {
    "id": "EXAMPLE-WHOLESALE-SELL-THROUGH",
    "canonicalName": "Partner Sell-through",
    "role": "CANONICAL",
    "lifecycleStatus": "ACTIVE_EXAMPLE",
    "formulaVersion": "15.0",
    "businessDefinition": "Period sales units divided by period sales units plus ending inventory units for the same partner/product perimeter.",
    "businessFormula": "SalesUnits / (SalesUnits + EndingInventoryUnits)",
    "calculationPrimitive": "COMPOSITE_EXPRESSION",
    "canonicalUom": "ratio",
    "grain": "PartnerID x ProductID x Period",
    "eligiblePopulation": "Partner/product combinations with governed sell-out flow and period-end inventory",
    "temporalClass": "FLOW_PLUS_ENDING_BALANCE",
    "aggregationRule": "Recompute from summed sales flow and compatible ending balance at the target perimeter; never sum percentages over time",
    "zeroNullErrorPolicy": "Sales=0 and ending inventory>0 gives zero; both zero is N/A",
    "directionality": "contextual_higher",
    "goalFunction": "TARGET_BAND",
    "owner": "Wholesale",
    "dataSteward": "Commercial data steward",
    "releaseStatus": "MAPPING_PENDING",
    "physicalSource": {"mappingStatus": "PENDING", "fields": []}
  }
]
